
{
  "id": "nails_l6",
  "order": 6,
  "title": "Handling Complaints",
  "description": "Giải quyết khiếu nại và xin lỗi chuyên nghiệp.",
  "thumbnail": "https://images.unsplash.com/photo-1590008828475-577319bbc832?q=80&w=400&auto=format&fit=crop",
  "context": {
    "background": "Ms. Minh không hài lòng vì màu sơn không giống mẫu.",
    "goal": "Xử lý tình huống căng thẳng và đưa ra giải pháp.",
    "characters": [
      { "name": "Tiên", "role": "Quản lý." },
      { "name": "Ms. Minh", "role": "Khách hàng." }
    ]
  },
  "steps": [
    {
      "id": "nails_l6_s1",
      "title": "Bước 1: Xin lỗi chuyên nghiệp",
      "purpose": "Xoa dịu khách hàng",
      "lines": [
        {
          "id": "nails_l6_s1_l1",
          "speaker": "Tech",
          "text": "I'm sorry for the inconvenience. Let me fix this for you.",
          "translation": "Em rất xin lỗi vì sự bất tiện này. Để em sửa lại cho chị ạ."
        }
      ]
    }
  ],
  "vocabularies": [
    { "id": "v1", "word": "Inconvenience", "translation": "Sự bất tiện", "ipa": "/ˌɪnkənˈviːniəns/" },
    { "id": "v2", "word": "Fix", "translation": "Sửa chữa", "ipa": "/fɪks/" }
  ],
  "grammar_points": [
    {
      "id": "g1",
      "title": "Apology",
      "description": "Cấu trúc 'I'm sorry for...'.",
      "examples": [{ "english": "I'm sorry for the delay.", "vietnamese": "Xin lỗi vì sự chậm trễ." }]
    }
  ],
  "roleplay": {
    "ai_instructions": "You are Ms. Minh. You are angry because the color is too dark and you are in a hurry.",
    "user_instructions": "Bạn là quản lý Tiên. Hãy xin lỗi, xoa dịu khách và đề nghị giải pháp nhanh nhất."
  }
}
